1,ジュニア級7月前半,,2021/5/21,2021/5/21
2,ジュニア級7月後半,,2021/5/21,2021/5/21
3,ジュニア級8月前半,,2021/5/21,2021/5/21
4,ジュニア級8月後半,,2021/5/21,2021/5/21
5,ジュニア級9月前半,,2021/5/21,2021/5/21
6,ジュニア級9月後半,,2021/5/21,2021/5/21
7,ジュニア級10月前半,,2021/5/21,2021/5/21
8,ジュニア級10月後半,,2021/5/21,2021/5/21
9,ジュニア級11月前半,,2021/5/21,2021/5/21
10,ジュニア級11月後半,,2021/5/21,2021/5/21
11,ジュニア級12月前半,,2021/5/21,2021/5/21
12,ジュニア級12月後半,,2021/5/21,2021/5/21
13,クラシック級1月前半,,2021/5/21,2021/5/21
14,クラシック級1月後半,,2021/5/21,2021/5/21
15,クラシック級2月前半,,2021/5/21,2021/5/21
16,クラシック級2月後半,,2021/5/21,2021/5/21
17,クラシック級3月前半,,2021/5/21,2021/5/21
18,クラシック級3月後半,,2021/5/21,2021/5/21
19,クラシック級4月前半,,2021/5/21,2021/5/21
20,クラシック級4月後半,,2021/5/21,2021/5/21
21,クラシック級5月前半,,2021/5/21,2021/5/21
22,クラシック級5月後半,,2021/5/21,2021/5/21
23,クラシック級6月前半,,2021/5/21,2021/5/21
24,クラシック級6月後半,,2021/5/21,2021/5/21
25,クラシック級7月前半,,2021/5/21,2021/5/21
26,クラシック級7月後半,,2021/5/21,2021/5/21
27,クラシック級8月前半,,2021/5/21,2021/5/21
28,クラシック級8月後半,,2021/5/21,2021/5/21
29,クラシック級9月前半,,2021/5/21,2021/5/21
30,クラシック級9月後半,,2021/5/21,2021/5/21
31,クラシック級10月前半,,2021/5/21,2021/5/21
32,クラシック級10月後半,,2021/5/21,2021/5/21
33,クラシック級11月前半,,2021/5/21,2021/5/21
34,クラシック級11月後半,,2021/5/21,2021/5/21
35,クラシック級12月前半,,2021/5/21,2021/5/21
36,クラシック級12月後半,,2021/5/21,2021/5/21
37,シニア級1月前半,,2021/5/21,2021/5/21
38,シニア級1月後半,,2021/5/21,2021/5/21
39,シニア級2月前半,,2021/5/21,2021/5/21
40,シニア級2月後半,,2021/5/21,2021/5/21
41,シニア級3月前半,,2021/5/21,2021/5/21
42,シニア級3月後半,,2021/5/21,2021/5/21
43,シニア級4月前半,,2021/5/21,2021/5/21
44,シニア級4月後半,,2021/5/21,2021/5/21
45,シニア級5月前半,,2021/5/21,2021/5/21
46,シニア級5月後半,,2021/5/21,2021/5/21
47,シニア級6月前半,,2021/5/21,2021/5/21
48,シニア級6月後半,,2021/5/21,2021/5/21
49,シニア級7月前半,,2021/5/21,2021/5/21
50,シニア級7月後半,,2021/5/21,2021/5/21
51,シニア級8月前半,,2021/5/21,2021/5/21
52,シニア級8月後半,,2021/5/21,2021/5/21
53,シニア級9月前半,,2021/5/21,2021/5/21
54,シニア級9月後半,,2021/5/21,2021/5/21
55,シニア級10月前半,,2021/5/21,2021/5/21
56,シニア級10月後半,,2021/5/21,2021/5/21
57,シニア級11月前半,,2021/5/21,2021/5/21
58,シニア級11月後半,,2021/5/21,2021/5/21
59,シニア級12月前半,,2021/5/21,2021/5/21
60,シニア級12月後半,,2021/5/21,2021/5/21
